NAME,POSITION,Market size,No of emp,DATE,TITLE,LIKE,DISLIKE,BENEFITS
Gereint C.,Head of Client Success,Mid-Market,51-1000 emp.,24-Feb-21,"""Great Product, even better support""","We evaluated a number of CS tools before eventually settling on Planhat. We chose due to how easy it is to standup, use and get value from as a tool to operationalize our CS methodology. It's a great platform but the service and partnership from the Planhat team is even better. Review collected by and hosted on G2.com.","Nothing to dislike, although I  would like to be able to better forecast margin. Review collected by and hosted on G2.com.","Planhat has helped up to better manage our customer lifecycle, leverage automation to deliver value at scale and drive proactive engagement into a segmented customer base. Review collected by and hosted on G2.com."
Unknown,Unknown,Small-Business,50 or fewer emp.,14-Apr-21,"""Great tool!""",Updates and enhancements to existing features - like the ability to categorize activities in on onboarding trackers.  Ths was an absolutely brilliant update!! Review collected by and hosted on G2.com.,Some features are not user-intuitive - like creating tasks in the customer portal.  I had to reach out to support to get assistance with this one.  Definitely not something I would have figured out on my own. Review collected by and hosted on G2.com.,"Prioritizing customer calls and organizing sales opportunities.  I have followed the new tiering model that gives us the opportunity to determine who needs help, who is doing really well, and where best to spend my time and attention. Review collected by and hosted on G2.com."
Genny F.,Director of Customer Success,Small-Business,50 or fewer emp.,27-May-21,"""Fantastic onboarding and support team!""",The onboarding and support team doesn't only explain how to use the platform but makes suggestions on how to organize your own processes. Review collected by and hosted on G2.com.,"Some of the buttons are not intuitive, but you can figure that out very quickly. Review collected by and hosted on G2.com.",Our client base was too large for the CS team to manually dig through stats and reach out to clients. Planhat has helped up automate high risk clients as well as automate reminders to clients about new features. Review collected by and hosted on G2.com.
Unknown,Strategy consultant,Enterprise,> 1000 emp.,14-Apr-21,"""A daily essential""",I like how quickly I can have a look at the history of a client's relationship & connect Gmail to have access to previous communications Review collected by and hosted on G2.com.,I dislike the fact that it sometimes takes too long to charge Review collected by and hosted on G2.com.,Make sure to go through the different filters to understand all the possibilites the tool offers Review collected by and hosted on G2.com.
Wiebke R.,Customer Success Manager,Mid-Market,51-1000 emp.,20-Jan-21,"""Great tool to structure your daily life as CSM""","The Health Score and the possibility to include usage from our platform/customers data in it. The Health Score helps me to have a good and quick overview of the ""health status"" of my customers.",Filter setups are sometimes not really intuitive. Review collected by and hosted on G2.com.,All customer data in one place and each CSM has the information at hand that is most important to them and their daily work days Review collected by and hosted on G2.com.
Bekkie W.,Unknown,Small-Business,50 or fewer emp.,29-Sep-20,"""Amazing support and assistance in getting set up!""","I am still in the onboarding phase of getting Planhat set up so I can't comment on everything once up and live but so far the help and support I have received has been amazing! Linda, Vitor and the team at Planhat have made the process enjoyable and are on hand to help with best practice and advice when needed!",Really not a lot - the only small things would be the complexity of the reporting functionality but Planhat are helping set this up - I just need to upskill myself more to make the most out of this feature Review collected by and hosted on G2.com.,"SO many! Visibility on the client portfolio and each team members progress, renewal tracking and forecasting,onboarding reporting and progress, automation of the process, data all in one place! Review collected by and hosted on G2.com."
Julia C.,Unknown,Small-Business,50 or fewer emp.,17-Dec-20,"""Planhat rocks!""",Changed our teams lives  We are working in a much better and more effective way thanks to Planhat! Review collected by and hosted on G2.com.,"The platform requires some time to get to know and understand, for example, some wordings in the platform are not fully consistent between pages. But a lot of improvements are happening all the time  Review collected by and hosted on G2.com.","Great platform, has everything you need. Price is reasonable compared to competitors. Review collected by and hosted on G2.com."
Unknown,Unknown,Mid-Market,51-1000 emp.,24-Feb-21,"""One Platform that gives me everything I want - I love it""",Switched to Planhat lately. ,The editors where we log notes and add content need to be more advanced and I believe it is serving the purpose for now but enhancing would help us centralize the data big time. Review collected by and hosted on G2.com.,Customer Success
Rotem R.,Product marketing lead,Mid-Market,51-1000 emp.,01-Feb-21,"""A great solution for customer success and enhancing user experience""",It's not just for CSMs but for many other aspects around making sure we know and feel the heartbeat. Helps to create better experiences for our users and apparently can be a great tool for me as a PMM. Review collected by and hosted on G2.com.,No enough integration with Intercom or for anything in terms of extracting data to other platforms. Need a better way to streamline user lists and attributes out to other platforms. Review collected by and hosted on G2.com.,Lists per actions and intents 
Hilton Y.,Head of Customer Success,Small-Business,50 or fewer emp.,24-Feb-21,"""Everything you need for a growing CS team""","No limit on seats, customer success team at Planhat very supportive, the support team is increasingly responsive and there are heaps of features to help us drive our business forward during our growth phase. Review collected by and hosted on G2.com.","It feels sometimes the platform is a little slow to respond, almost as if the servers are struggling. Review collected by and hosted on G2.com.",We're helping develop a one source of truth across our growing customer base. Review collected by and hosted on G2.com.
Chloe  H.,Customer Success Manager,Mid-Market,51-1000 emp.,15-Jan-21,"""Has improved productiveness and quality of touch points with my customers""",#NAME?,- Can't yet get analytics on a user level Review collected by and hosted on G2.com.,"- can prioritise customers based on their usage of the platform, if they've any unpaid invoices etc. Previously it took us a long time to see who needed our attention which was normally based on ARR and user activity and we had to look for this information in multiple tools, this is now all in one place and can be notified when a customer needs my attention"
Team B.,Unknown,Small-Business,50 or fewer emp.,01-Sep-20,"""We've streamlined our operations during COVID with Planhat while working remotely""",Planhat's customisability allows us to to record and integrate client and contact information that it non-standard but critical to our operations. We've been able to use this additional information to trigger and manage playbooks that allow us to automated our business processed.,Nothing. They're constantly improving the product and everytime we think 'wouldnt it be nice if we could' a new feature is added that enhances our ability. Their support is quick and are clearly expert users of their system. Review collected by and hosted on G2.com.,"The key business problem that we solve with planhat is a complex and path dependent series of business processes for client signup, on boarding and retention. Previously we relied on slack, excel sheets and face to face communication/meetings to keep everything on track. This became impossible this year and our move to Planhat mean that remote working became just...probably more seemless than our old processes. Review collected by and hosted on G2.com."
Anna G.,Unknown,Mid-Market,51-1000 emp.,28-Aug-20,"""Gives us a great overview of customer portfolio & super helpful CS Team!""","- Very customizable software (actions, triggers, playbooks, products, lifecycle - you name it)",#NAME?,We needed to get an overview of our customer portfolio (incl. health score) and track actions/events within an account so that everyone in the CS team is aware of the current status. 
Unknown,Unknown,Small-Business,50 or fewer emp.,10-Nov-20,"""Been using almost a year review""",Planhat has a relatively straightforward user interface; you will be able to jump straight into the account page with little training and will have no problem navigating as a general user. It is also highly customisable & integratable provided you are able to script out what information you need to feed into Planhat. Review collected by and hosted on G2.com.,1. Lack of timestamp although last update was that this is in the pipeline.,"We would like to use Planhat as our end to end CRM, from customer onboarding, identifying low health scoring merchants that require some tender love & care, housing all important information, and down to their renewals. Review collected by and hosted on G2.com."
Carmel A.,Customer Marketing Manager (Product Marketing),Mid-Market,51-1000 emp.,24-Feb-21,"""Great tool and recommended... integrations a tiny bit lacking""","The power and flexibility of reporting is great, and it's DEFINITELY built for CSMs. Review collected by and hosted on G2.com.","Limited integrations/ability to take data outside of Planhat. Not a killer, but for NPS especially would be SO GOOD if it linked to Google Sheets for example. Review collected by and hosted on G2.com.",The customer views are so powerful. Knitting everything together means being up to speed super fast. Review collected by and hosted on G2.com.
Michael E.,Unknown,Mid-Market,51-1000 emp.,05-Aug-20,"""Review of Planhat from a BizOps perspective""","- Laser focused on CSM and their needs, rather than trying to fit all. This works well for those making the choice to choose the best product for each team's need, rather than trying to horseshoe a single product across teams","Online help centre articles could be a little more fulsome and up to date, but high quality support means this is not a big problem Review collected by and hosted on G2.com.",#NAME?
Unknown,Unknown,Mid-Market,51-1000 emp.,14-Apr-21,"""Una gran ayuda para CSM""",Es genial tener toda la informacin en un solo sitio. El servicio de su soporte es genial Review collected by and hosted on G2.com.,"La UX puede ser poco intuitiva, a veces es difcil encontrar lo que necesitas Review collected by and hosted on G2.com.",Cuesta un poco adaptarse a su UX pero una vez que te acostumbras y entiendes la plataforma puedes sacar un beneficio enorme. Review collected by and hosted on G2.com.
Chris J.,Customer Success Director - EMEA,Mid-Market,51-1000 emp.,02-Feb-21,"""Fantastic, easy to use platform that helps give structure to our Customer Success team""",The ease of navigation and customisation possible. Review collected by and hosted on G2.com.,I think the reports and dashboards could be a little more intuitive to build - but overall they are fantastic. Review collected by and hosted on G2.com.,"Trying to track customer contact, while also looking at trends on our customers, and making our CS team's lives easier, so that they can focus more on the customer. Review collected by and hosted on G2.com."
Andy K.,Head of Customer Success,Small-Business,50 or fewer emp.,24-Feb-21,"""Beautiful intuitive software that has helped me reduce my churn""",Intuitive building blocks that come together to create powerful set of tools; Review collected by and hosted on G2.com.,"Reporting functionality has been limited, but is getting better Review collected by and hosted on G2.com.",Managing 1000 customers - combines CRM and interaction /task management to help focus CSM time on the right customer at the right time Review collected by and hosted on G2.com.
Oliver B.,Unknown,Enterprise,> 1000 emp.,07-Oct-20,"""allows me to have my clients' information in a much more secure and digitized way""","It has a very friendly interface that allows me to navigate through the entire system without any inconvenience, its customer service team is quite receptive when it comes to commenting on any questions or problems that arise during the use of the system, in addition allows me to adapt to the needs of my clients and to organize their requirements in a much simpler and simpler way, since it has a virtual board that is perfect for this function, not to mention the fact that it also allows me to have a much more secure and digitized my clients' information, thus achieving a virtual database that I can access at any time. Review collected by and hosted on G2.com.","Sometimes the performance decreased a bit, however I think it is due to the quality of the internet, that is, if it is low, the performance will also be impacted. Review collected by and hosted on G2.com.","Above all, to achieve a better order and control of my clients' information, in such a way that I can solve their requirements in the shortest possible time and manage to continue having a very good relationship with my clients in terms of service. refers, so that in that way they are encouraged to continue acquiring my products and services. Review collected by and hosted on G2.com."
Unknown,Unknown,Mid-Market,51-1000 emp.,15-Jul-21,"""Planhat is pretty rad""",Planhat has allowed our company to understand better/communicate with our customers. It's simple to use and has plenty of flexibility in terms of functionality. Review collected by and hosted on G2.com.,I do not have any dislikes regarding planhat. Review collected by and hosted on G2.com.,The main issue it has helped us with is being more proactive and less reactive with customers. Review collected by and hosted on G2.com.
Tom L.,Customer Success Manager,Small-Business,50 or fewer emp.,28-Sep-20,"""Powerful tool with an incredibly supportive team to back it up!""","Planhat has allowed us to move away from an often chaotic mix of spreadsheets, Hubspot & several other tools to manage customer information, and allows us to serve up the right data at the right time, enabling us to be a far more proactive team.  ","The only downside we have come across is that you can't automatically assign an owner to a company based on a set of rules. I believe this is coming in future iterations of Planhat however, and the team have been incredibly responsive to any of our product questions and suggestions. ","We have consolidated all of our CS data into one place, everyone is working in a consistent way and we now have visibility into the data-driven health of our customer base."
Unknown,Unknown,Small-Business,50 or fewer emp.,14-Apr-21,"""Software is slightly iffy but love the overall functionality""","Customization and depth of data, helps me organize my client accounts, I like that it integrates with our other CRM, SuperAdmin Review collected by and hosted on G2.com.","Some pages take a LONG time to load, often have to reload/refresh pages Review collected by and hosted on G2.com.",No specific benefits but I feel like there is endless functionality with Planhat that I am still discovering Review collected by and hosted on G2.com.
Unknown,Unknown,Mid-Market,51-1000 emp.,14-Apr-21,"""Great platform! Easy and helping our day to day Customer Success Team !""",#NAME?,Nothing (or nothing major) : maybe some tabs can be easier understand Review collected by and hosted on G2.com.,"Planhat helps us a lot in our day to day Customer Success Team: reminders, NPS, follow up,... The tool centralized all the info that we need and you can check it in one glance ! Review collected by and hosted on G2.com."
Ashton B.,Implementation Manager,Small-Business,50 or fewer emp.,19-Jun-20,"""A Good Enough System""",Unknown,Unknown,Unknown
Unknown,Unknown,Mid-Market,51-1000 emp.,01-Feb-21,"""Quick value, good customer service""",#NAME?,#NAME?,#NAME?
Marcelo S.,Unknown,Small-Business,50 or fewer emp.,20-Jul-20,"""Amazing CS Software, we can do everithing about managin customers there""",Planhat is very clean and easy to use.,"The software use to be a little slow, but that is solved from somedays ago, I dont know if it is something temporary or not, but now its amazing. Review collected by and hosted on G2.com.","Go forward, it is an amazing software, the support is very good too, they are always available to help Review collected by and hosted on G2.com."
Megan K.,Unknown,Small-Business,50 or fewer emp.,24-Nov-20,"""Great support from their team and so many use cases supported!""",The support - Sabrina is always on hand to help and has great suggestions. They also take a lot of our suggestions which is great. Review collected by and hosted on G2.com.,"It is complicated, you can use the product for so many things and it has incredible scope, but you also need a detailed knowledge if it. Review collected by and hosted on G2.com.","A lot of problems are solves - data accessibility, retention, onboarding. We are still discovering more! Review collected by and hosted on G2.com."
Unknown,Unknown,Mid-Market,51-1000 emp.,14-Apr-21,"""360 degree coverages""",Easy to use.  Flexible in usage.  Simple but powerful queries. Review collected by and hosted on G2.com.,Better Sorting.  Need multi-level sorting. Review collected by and hosted on G2.com.,You need to know what you are looking for to get the best value out of it. Review collected by and hosted on G2.com.
Unknown,Unknown,Enterprise,> 1000 emp.,08-Aug-20,"""The single source of truth for our CS team!""","Knowing what to prioritize when managing a team of 30 CSMs with over 3,000+ customers is difficult,  and I often ended up being reactive.","My advice : It is a  powerful and comprehensive tool, so figure out which parts of Planhat to adopt first so you can roll it out successfully. Review collected by and hosted on G2.com.","CS can become difficult as you scale your organization. There are hundreds of KPIs to keep track of from QBRs, to user engagement, to the number of tickets per client, the list is endless. "
Unknown,Unknown,Mid-Market,51-1000 emp.,24-Feb-21,"""Very efficient software""",Customization options and the ability to log multiple contact methods all in one place. Review collected by and hosted on G2.com.,My only complaint is our Salesforce integration is only one-way but that may be a Salesforce complaint and not a Planhat complaint Review collected by and hosted on G2.com.,"Outreach consistency, Account health, optimal touchpoints and methods, and so much more Review collected by and hosted on G2.com."
Eric  F.,Account Manager,Enterprise,> 1000 emp.,15-May-20,"""The ONLY tool I would recommend for real time analysis for any Client Success Professional!""","The tool itself is extremely easy to use with a very clear aesthetic that allows me to see scores for various indicators for my clients at a glance. It is a lot more powerful than it looks, especially when coupled with the proper implementation. I use it daily to keep my portfolio healthy, reduce churn, and grow my accounts. Review collected by and hosted on G2.com.","Implementation to get full analytics can take a bit of time, but it is well worth it when compared to the level of insights you can access! Review collected by and hosted on G2.com.","The tool allows me to manage my portfolio of clients in its entirety and visualize various KPIs for engagement and usage across different visualization graphs and charts. I am able to maintain a pulse on health scores, usage, key value points for clients in relation to the last touch point and renewal date. Updating in real time, I always see a revolving door of information that prompts me updates for each of my clients as the day progresses. Through sorting based on ""Last Active"", I can see which users are focusing on what aspects of my product (all-day) and from there be able to strategically consult them based on their priorities. I have a window with Planhat open at all times on one of my monitors."
Patty B.,Unknown,Enterprise,> 1000 emp.,14-May-20,"""Easy to implement, easy to integrate, excellent support""","Easy to Implement.  We had an aggressive implementation schedule, and the Planhat team helped us meet our dates.",The API documentation is sometimes out of date. Review collected by and hosted on G2.com.,"I have a very narrow focus - my team's objective was to make sure that Sales Reps could get a 360 degree view of their client base and how engaged they are - which products and features are being used, and where might the client need more help to get full benefit of our software. Review collected by and hosted on G2.com."
Nicholas T.,Customer Success Manager,Small-Business,50 or fewer emp.,24-Feb-21,"""usefull tool that almost cover our needs in the customer care team""","the portal, the ease of use to make some integration Review collected by and hosted on G2.com.",Probably the missing access to full history of our customer (part of the integration we are done right now),Better communication between our teams and tailormade solution for us... Review collected by and hosted on G2.com.
Camille R.,Unknown,Small-Business,50 or fewer emp.,01-Sep-20,"""Using Planhat for a year now!""",#NAME?,#NAME?,- Helps us have a 360 view of our customer portfolio
Unknown,Unknown,Mid-Market,51-1000 emp.,14-Apr-21,"""Planhat has been great to use!""",Planhat is very intuitive and easy to navigate. I love the actions and playbook functions. Review collected by and hosted on G2.com.,I have used other CS tools and am not finding much to dislike with Planhat as I had with other tools. Review collected by and hosted on G2.com.,I can clearly track customer action items and follow-ups. A benefit is I feel things are very organized within Planhat. Review collected by and hosted on G2.com.
Sam S.,Unknown,Mid-Market,51-1000 emp.,06-May-20,"""The best Customer Success tool out there with a wonderful team behind it""","Planhat changed how we work as a company and is used across our business from CSMs, Customer Marketing, Sales, Product and Finance. It gave us one source of truth for our customers, allows us to communicate effectively with our customer base and improved our financial reporting - saving us time and money spent on other tools.","Like any new software you need to invest time in learning how to use it, we have been using Planhat for over a year and haven't found any drawbacks. Review collected by and hosted on G2.com.","List out all your requirements and plan how you want to assess/compare tools, it allows you to make the most out of your free trial and for the Planhat team to understand how it can work for you. Review collected by and hosted on G2.com."
Heathcliff H.,Unknown,Small-Business,50 or fewer emp.,23-Jul-20,"""The Goldilocks CS Platform - it's 'Just Right'""",Up and running in a day (including integration with Salesforce).,I wish my onboarding experience had been more organized.  We got up and running very fast but I could have benefited from some formal training on best practices. Review collected by and hosted on G2.com.,"I now have a 360 degree view of all conversations my colleagues are having with customers.  I am able to onboard customers consistently using Playbooks, easily manage NPS surveys, log and manage activities.  Planhat is our system of record for customer engagement. Review collected by and hosted on G2.com."
Sandra W.,Customer Success Manager,Mid-Market,51-1000 emp.,24-Apr-20,"""A great tool for our Customer Success Managers and the whole CS-team""",I love the fact that Planhat is so userfriendly. Not much training needed to be done at our CS team. The solution is easy to configure and you can customize the solution to fit your needs. ,"Some smaller features, like ordering our lists after they are produced would be meaningful. I also miss a feature where the team can add tags and labels, but not make new ones. But they collect our ideas, and I hope this will be fixed in the near future. Review collected by and hosted on G2.com.","Planhat gives us the data we need to handle customers, to avoid churn, and to upsell modules with less work and investigation than earlier. Now we also have a tool that can be used by other parts of the organization, like support, so they know the history, the dialogue, the offers that are sent out, and so on. Review collected by and hosted on G2.com."
Rachel R.,Director of Customer Success,Mid-Market,51-1000 emp.,24-Feb-21,"""Planhat is an essential CS management tool""",The fact that I can easily see all communication to accounts,Does require manual customization,Health of our clients Review collected by and hosted on G2.com.
Unknown,Unknown,Mid-Market,51-1000 emp.,24-Feb-21,"""The Best tool to manage your clients!""","Planhat allows you to keep everything up to date, and keep track of everything. Review collected by and hosted on G2.com.",Only one language is available.Sometimes it is difficult to communicate with them Review collected by and hosted on G2.com.,Sometimes it is difficult to communicate with them Review collected by and hosted on G2.com.
