NAME,POSITION,Market size,No of emp,DATE,TITLE,LIKE,DISLIKE,BENEFITS
Patricia A.,Client success manager,Small-Business,50 or fewer emp.,18-May-22,"""Great CS management tool""","The ""easy to use"" feeling and how it looks - very clean, simple and intuitive. I also like the fact that you can visualize things like revenue, account mapping and customise your panels to filter the information that is most relevant to you. Mapping users and creating the relevant tags is another great feature, as it allows us to easily identify  the different roles different contacts have in the account, without having to source this information elsewhere. Review collected by and hosted on G2.com.","The activity tab can get quite confusing, even when you apply the filters. It would also be handy to be able to have more than one person responsible for an action. Review collected by and hosted on G2.com.","It makes managing my CS base SO much easier! It also is a great way to help me plan my day and ensure the activities agreed with individuals are kept on track, without having to create different calendar reminders or notes. I really like the fact that you can combine planned activities as playbooks with add-hoc engagement and schedule follow ups for these. I cannot imagine having to manage my account stack without Planhat - I serve a mix of high, low and tech touch clients and setting up filters and sub-categories has helped me focus on the right accounts ate the right time. Also being able to see accounts based on their lifecycle is a huge benefit, as it allows me to concentrate efforts and plan my monthly/ quartly and half yearly engagement strategy. Review collected by and hosted on G2.com."
Emma W.,Customer Success Manager,Mid-Market,51-1000 emp.,17-May-22,"""An exceptional product for Customer Success Professionals""","The number of fantastic integrations! All info for our customers from Zendesk, Salesforce, Gmail, and Mixpanel is in one place. I also love the Planhat team. Our Customer Success Manager Laura is very knowledgable and offers fantastic suggestions. The Support Team are also brilliant and I love that it is in the product. Review collected by and hosted on G2.com.",I honestly can't fault Planhat. I probably am your number 1 fan! I actually get teased at work for it. Review collected by and hosted on G2.com.,"For us, having a full understanding of our customer base has been revolutionary. The reporting, customisable toggles and fields have been so useful to us. The onboarding experience for our customers has already improved due to Playbooks and the customer portal. We have been able to roll out a Tech Touch program to the whole organisation thanks to Planhat. All of our customers no matter the size will now get a great customer experience. Review collected by and hosted on G2.com."
Isabelle R.,Customer Success Manager,Small-Business,50 or fewer emp.,28-Oct-22,"""Planhat is an excellent Customer Success tool""","Accessibility of usage data, workflow automations, integrations with existing tech stack, responsiveness of the Planhat team. Review collected by and hosted on G2.com.","It takes a lot of resources to configure Planhat to work optimally for your company. However, the Planhat team is very helpful during this process. Internal preparation is required prior to pursuing Planhat onboarding. Review collected by and hosted on G2.com.","Planhat allows us to centralize all of our data, optimize and manage our customer relationships. Review collected by and hosted on G2.com."
Taylor C.,Head of Customer Success,Mid-Market,51-1000 emp.,01-Nov-22,"""Extremely Intuitive""","Planhat is simple to usee, extremely powerful, has straightforward billing and customer support is bar none the best. Shout out to our awesome CSM Peter! Review collected by and hosted on G2.com.",The only downside I have is no guided LMS for new users to use! Review collected by and hosted on G2.com.,"Planhat provides our solutions for customer contact, usage tracking, kpi measurements, as well as giving me vital leadership insights for my team. Review collected by and hosted on G2.com."
Unknown,Unknown,Mid-Market,51-1000 emp.,24-Oct-22,"""Planhat gave us the insights we lacked before we used their platform""","The pretty straight forward dashboards you can build for your CSM team, since they should not be bothered with too complex follow up. They have enough on their plate. Review collected by and hosted on G2.com.",The usage of filters and logic behind some of the automation is less straightforward than we expected and can be quite time - consuming. Also we thought the integration went further than what it is today Review collected by and hosted on G2.com.,"Giving us insights in our client's health in one place, instead of having to consult 3 different resources. Also granting them the right user permissions gives them the autonomy they might want to create their own overviews Review collected by and hosted on G2.com."
Angeles A.,Customer Success Manager,Mid-Market,51-1000 emp.,16-Aug-22,"""Perfecto to manage your clients!""","How it easily displays all the info, and that is possible to linke it with other platforms like Slack, hubspot, etc i really like because its really clear and user friendly Review collected by and hosted on G2.com.","Sometimes i have problems loggin in, or i have to refresh the page. but otherwise it has everything good and the chat always help us, also our CSM is really helpfull when we need her Review collected by and hosted on G2.com.","To manage all the information of the clientes of all the group! its really really cool, and helpfull to have also an overview of my clients and be prepare for renew Review collected by and hosted on G2.com."
Unknown,Unknown,Mid-Market,51-1000 emp.,01-Nov-22,"""Intuitive platform, great service""","I really like that the platform bends well to different needs. Its easy to create custom fields and metrics that make portfolio building and customizing a nice experience. Their live support is fast and reliable, and CSMs are proactive. Review collected by and hosted on G2.com.","Integration with our current CRM, Hubspot. Managing the Deals > Licenses setup has taken some time for us, but this has also to do with our own products/contract types. Review collected by and hosted on G2.com.","Planhat gives our CSM team portfolio management transparency and a tool to work in a unified way as a team in very practical things. As a manager, it is easy to stay up to date with portfolio statuses, and cases that require attention. I feel like we are still to unlock many benefits of the platform but we are taking steps to do that. Review collected by and hosted on G2.com."
Lauren E.,Head of Customer Success,Small-Business,50 or fewer emp.,13-Jun-22,"""Great tool for consolidating your customer data""",Having a single source of truth that can consolidate all data pertaining to a customer's account. Review collected by and hosted on G2.com.,There is a lot to learn and navigating the interface isn't always intuitive. Review collected by and hosted on G2.com.,"Planhat is solving multiple problems for me and my team. Previously to Planhat, we were monitoring customer health across multiple tools and excel reports. Planhat has allowed us to consolidate all of this data into a single platform. We can now create even more detailed health metrics which will allow us to truly scale the customer success function. The software will also allow visibility to other departments that was previously hard to manage. Marketing can see our champions, Sales can identify growth accounts and Product can monitor how often our customers access and engage with our tech. Review collected by and hosted on G2.com."
Al T.,Head of content,Mid-Market,51-1000 emp.,13-Nov-22,"""Simple to use and saves so much time""",I love how intuitive the system is and being able to see live data and information without spending ages finding it. Review collected by and hosted on G2.com.,There don't appear to be any out of the box tech touch options. This would be really helpful. Review collected by and hosted on G2.com.,All Information in one place which saves so much time. Review collected by and hosted on G2.com.
Unknown,Unknown,Small-Business,50 or fewer emp.,20-Oct-22,"""Quick time-to-value!""","We have been using Planhat for 5 or 6 months. In that short time, we have been able to realize solid value for the level of effort we've extended.  Could not have done it without our amazing Onboarding Consultant - he really helped us think through the way we were operating. Review collected by and hosted on G2.com.","We have a complex prooduct portfolio and we have come across some challenges in our implementation. There were also a few integrations that have not gone smoothly, although our Planhat team is doing the best they can to help us through it. Review collected by and hosted on G2.com.","We have multiple business areas supporting multiple products. Before Planhat, we didn't have a common way of working, and each business area operated on its own. We still have very unique processes, but Planhat allows us to have visibility across product lines. Review collected by and hosted on G2.com."
Renata S.,Human Resources Specialist - Iberia,Small-Business,50 or fewer emp.,03-Nov-22,"""Useful and user friendly""","What I like the most is that I can keep track of my clients, metrics, revenue, contact information, and I also like the feature that all my emails are linked to the platform and is visible to anyone with access Review collected by and hosted on G2.com.","Sometimes I update things, and it doesn't stay. Review collected by and hosted on G2.com.",Keeping track of my clients Review collected by and hosted on G2.com.
Unknown,Unknown,Mid-Market,51-1000 emp.,04-Nov-22,"""Planhat makes it easy!""",The best things about Planhat are the automated features and the easy-to-use tabs and buttons.  I enjoy the platform's capabilities as well as the delicate controls in place. Review collected by and hosted on G2.com.,I wish the program would allow more views especially when it comes to viewing the NPS scores and comments.  Also wish the program would allow for more personalized settings. Review collected by and hosted on G2.com.,Planhat helps me with customer outreaches. It also helps me monitor customer health and provides insight to usage.  This save me from a lot of digging around as well as less communication errors. Review collected by and hosted on G2.com.
Unknown,Unknown,Mid-Market,51-1000 emp.,18-Oct-22,"""Data driven customer engagement""","I like how flexible and data-driven the platform is. Excellent customer service (CSM + Technical Engineer).
",The reporting part of the platform could be better. It needs more options and flexibility. The option to drill deep into graphs and charts and see the underlying data points for the visual representation is crucial. Review collected by and hosted on G2.com.,"It is helping us engage with our customers in a more structured way and gives us insight into how they are doing in their lifecycle, as well as having a lot of information in one place. Review collected by and hosted on G2.com."
Unknown,Unknown,Mid-Market,51-1000 emp.,01-Nov-22,"""Working with PlanHat on a daily basis.""",I really like PlanHat's simplicity and the way it interacts with other apps. I find myself using PlanHat at least 4-5 hours a day as it's part of my day to day work and I very rarely get any delays or malfunctions with the software. Review collected by and hosted on G2.com.,"I would say that the Filters tab can definitely use some attention. It is functional; however, I do believe that it has greater potential in general. Would love to see some changes made to that in the near future. Review collected by and hosted on G2.com.","PlanHat is saving us a lot of time when it comes to keeping track of everything you do on a daily basis. I highly appreciate the time PlanHat saves me each day, as I'm able to focus on more important tasks with their automation. Review collected by and hosted on G2.com."
Unknown,Unknown,Mid-Market,51-1000 emp.,01-Nov-22,"""A solid customer success platform""","Delightful user interface, strong self-serve configurability, good support, insightful webinars, gives you exposure to strong CS practices applied to you as a customer Review collected by and hosted on G2.com.","Can be a bit buggy at times, with data not showing up properly. No project planning (e.g. Gantt) features for complex implementations Review collected by and hosted on G2.com.","Visibility into my account portfolio (a source of truth), actionable visualizations for the data I need to report and operate on, the data I need at my fingertips (vs asking people for it), a pulse on the health and risks in my portfolio Review collected by and hosted on G2.com."
Unknown,Unknown,Mid-Market,51-1000 emp.,17-Oct-22,"""just another level""","Everything is awesome to Planhat
","the issue is that you can do anything in the plateform . Therefore you need to know what you want to know
","time, visibility, priorization Review collected by and hosted on G2.com."
Adah S.,Customer Success Manager,Mid-Market,51-1000 emp.,22-Sep-22,"""The Customer Success platform!""",The insights you get with all the different modules in your customers is exactly what every Customer Success team needs! Review collected by and hosted on G2.com.,I don't believe I have any dislikes because there are many ways to set up your (personalized) customer platform; you'll always find a way that works for you. Review collected by and hosted on G2.com.,Really getting to know your customer needs on a deeper level by identifying the problem before it becomes a pain. Review collected by and hosted on G2.com.
Unknown,Unknown,Mid-Market,51-1000 emp.,08-Dec-22,"""Great CS Platform!""",Planhat has great integrations and data handling which allows a CSM to efficiently manage a dynamic customer portfolio and gather meaningful insights. Review collected by and hosted on G2.com.,"We are still in the early days of implementation, but haven't found major downsides. The customer support from Planhat is top notch in finding solutions to any roadblocks. Review collected by and hosted on G2.com.","A full handling of our customer portfolio's, identifying opportunities and taking actions. Helping us to scale efficiently. Review collected by and hosted on G2.com."
Melody J.,CSM,Mid-Market,51-1000 emp.,03-Nov-22,"""Planhat is a great CSM tool with a lot of possibilities that helps me in my daily work!""",#NAME?,I'd like a better solution for preview/testing the NPS before sending it out. Review collected by and hosted on G2.com.,"It helps me gather data from many sources, so it saves me time and helps me to prioritize 
"
Unknown,Unknown,Small-Business,50 or fewer emp.,23-Dec-22,"""Planhat - the best CS software, head & shoulders above the rest""","Clear concepts & language, most fully feature, best usability (UX/UI) of all CS software by a mile Review collected by and hosted on G2.com.","Always room for improvement, more capabilities around dashboards / business intelligence would be great in time Review collected by and hosted on G2.com.","Process consolidation, execution, clarity, accountability & visibility in our Customer Success function Review collected by and hosted on G2.com."
Casey C.,"Vice President, Strategic Initiatives",Enterprise,> 1000 emp.,01-Nov-22,"""Planhat's playbook approach is a perfect fit for our company and how we want to support our clients""",The Planhat playbooks allow our team to continue to evolve on how we want to support our client's success. We quickly adapt as our clients need change. Review collected by and hosted on G2.com.,The training support for our internal team and train-the-trainer program needs some improvement. We know the Planhat is currently working on a solution for us and we look forward to that plan. Review collected by and hosted on G2.com.,Our company needed to manage better the entire client journey. The benefit is creating a deeper relationship with our customers and lowering churn. Review collected by and hosted on G2.com.
Abhishek W.,Customer Success Manager,Mid-Market,51-1000 emp.,07-Jul-22,"""Best CRM for Enterprises Business""",I love the molding behavior of the app. You can create your own CRM as per your need for your own Business. I love the Customer Intelligent feature as well. Buy it. Review collected by and hosted on G2.com.,"Here I am unable to find the meetings logged in as we are not able to create a filter end-user-wise. Furter, Unable to save future opportunities in the Planhat. Review collected by and hosted on G2.com.",It is like creating your own CRM like creating your own website. Review collected by and hosted on G2.com.
Unknown,Unknown,Mid-Market,51-1000 emp.,08-Nov-22,"""Flexible Platform and API Makes it great for getting what you want out of it.""",I really enjoy how flexible and straightforward the API is. It makes adding that extra bit of functionality you need very easy. Review collected by and hosted on G2.com.,"There are some idiosyncracies with how the activity model is setup splitting this into two different tables on the backend, making it confusing at times. Review collected by and hosted on G2.com.",We were previously using a much more complex/robust solution that honestly overwhelmed our users. The UI is simple and straightforward so folks are already at ease diving in. Review collected by and hosted on G2.com.
April B.,Senior Partnership Success Manager,Small-Business,50 or fewer emp.,03-Nov-22,"""Planhat helps streamline managing high volumes of onboarding new districts at TalkingPoints""",We love the two-way integration with SF and Gmail. Review collected by and hosted on G2.com.,Text editors in Portal and email templates Review collected by and hosted on G2.com.,We onboard several districts a week and Planhat helps us keep up with the phases provides reminders for upcoming meetings via Google Calendar integration. Review collected by and hosted on G2.com.
Unknown,Unknown,Mid-Market,51-1000 emp.,29-Sep-22,"""Great platform which has allowed us to streamline our workload.""","I really enjoy using playbooks. It makes tasks easy to follow, ensuring no steps are missed in the process. As well as this having access to all the platforms our workplace uses in one place really makes it easy for day to day tasks. Review collected by and hosted on G2.com.",It can be very fidgety to begin with as there are a lot of tabs and each time you click it takes you to a new page. I am use to Zendesk which creates tabs so you can always go back to your previous page easily. Review collected by and hosted on G2.com.,"Planhat is allowing us to have all platforms in one place for easy access to access customer information, as well as sales information. This makes it a lot easier to communicate with our customers and also perform our tasks more easily. Review collected by and hosted on G2.com."
Beatriz F.,Team Lead Customer Success Manager,Mid-Market,51-1000 emp.,11-Aug-22,"""Powerful and amazing tool for a Customer Success""","Planhat is easy to use. Their activities, playbooks and overviview makes it easy to track the team task and our clients. It connects perfectly with Hubspot and Zendesk Review collected by and hosted on G2.com.","It's a pity that you can't change the language, but otherwise it's a perfect tool. Review collected by and hosted on G2.com.",Keeping control and having a good overview of our customers' life.  Planhat also helps with getting an overview of results and forecasts. And Planhat also help me manage our customers' health based on usage in our platform. Review collected by and hosted on G2.com.
Tim v.,Customer Success Manager,Mid-Market,51-1000 emp.,29-Jun-22,"""I love the insight into the health of our customers and being able to react immediately to changes.""",To have data presented to you in a few seconds that took hours before Planhat. Review collected by and hosted on G2.com.,"Schedule meetings using the date and time picker. The time picker is not user-friendly. 
","It takes some time to get your data points in Planhat, but this is a very important step to get the most out of it. Review collected by and hosted on G2.com."
Unknown,Unknown,Mid-Market,51-1000 emp.,09-Nov-22,"""Excellent platform to aggregate all CS data and ensure all parts of the org are aligned""","Planhat allows our implementation team, CSMs, operations team, and leadership to have visibility into all customer-related activities and metrics, including usage data, customer health scores, customer communications, and more. The platform enables our team to efficiently collaborate and communicate regarding everything customer-related. Since implementing Planhat, our understanding of our customers has dramatically improved. Review collected by and hosted on G2.com.",The Customer Intelligence module is limited and oftentimes requires convoluted formulas to get close to the data our team wishes to derive. The NPS module is also rather limited in terms of customization and broader surveying functionality. Review collected by and hosted on G2.com.,"Planhat connects and tracks all customer data, allowing our team to engage proactively in customer outreach. Review collected by and hosted on G2.com."
Unknown,Unknown,Small-Business,50 or fewer emp.,27-May-22,"""Excellent tool for Customer Success Management!""","Planhat can be modified to suit my CS team's needs, it can automize everyday work and it has given us important insights about our clients. The customers' portals is also a very interesting and useful tool for my company. Review collected by and hosted on G2.com.","Some specialized tools (such as Monday.com) can't be automized in Planhat, so some manual work is needed. Also, many things are not so straigh-forward. Fortunately, we had a lot of support from our CSM. Review collected by and hosted on G2.com.",I would recommend having the whole process and the results from each step before going into planhat. It makes planning was easier and it makes you use Planhat to get what you need. Review collected by and hosted on G2.com.
Unknown,Unknown,Mid-Market,51-1000 emp.,14-Oct-22,"""Not only is Planhat a powerful tool, but their team is amazing to work with too!""","It's a very intuitive platform that gives you a 360 view of our customers.
",You often need to hard refresh the page to see the latest data or changes applied. Review collected by and hosted on G2.com.,"Planhat is giving us a better customer overview, we can finally see who are customers are and which value they are getting. 
"
Kamna P.,Senior Customer Success Operations Specialist,Mid-Market,51-1000 emp.,08-Mar-22,"""Great internal tool for collaboration and an awesome pricing structure.""","I like that the tool charges us based on our growth, and allows us to add as many users to the platform internally as we need. This encourages us to collaborate, even when our CRM is limited in licenses, and also gives us all visibility into our growth. Review collected by and hosted on G2.com.","There are lots of little bugs and kinks and it takes a dedicated person to implement the tool and monitor it for accuracy. For instance, when a new field is added to SF, we have to then add it manually to PH, and then resync to get it to pull that data, and it can be hard to manage all the different objects we have in SF in terms of integrations, but the customer success team at PlanHat are great and always ready to help us with this stuff either via email, support chat, or our weekly sync. Review collected by and hosted on G2.com.","Setup from the getgo is very important, don't rush through it. We had several organizational changes during our implementation and rush many parts which made it much hard to cleanup and fix or even understand after the fact. Also, document everything you are pulling in and doing for this reason. Review collected by and hosted on G2.com."
Unknown,Unknown,Mid-Market,51-1000 emp.,23-May-22,"""Great CS tool + Continual Improvement""","Our CSM and their customer service team are very helpful and quick to respond, the tool has many great capabilities and new features are coming out all the time, the ability to grant permissions to different groups of users in a very detailed way, and once you get used to the layout + functionalities, it's easy to move around. Review collected by and hosted on G2.com.","You can't create cross-object reports without creating filters on other objects, moving around within the tool isn't as intuitive as it could be, some of the Salesforce syncs act differently than they should, upcharges for a few things that should be included (at least minimally) in your upfront purchase (like customizing pages, etc), the fact that it does not pull in opportunity information from salesforce, just product/subscription info. Review collected by and hosted on G2.com.","A place for our CSMs to live outside of Salesforce that contains our product usage information + information about the accounts & subscriptions, and the ability to easily share information to leadership. Review collected by and hosted on G2.com."
Unknown,Unknown,Mid-Market,51-1000 emp.,19-Oct-22,"""All customers always in sight""","Intuitive interface, quickly learned/understood by every employee
",Planhat works as good as without bugs. We are super happy with that tool Review collected by and hosted on G2.com.,"we manage existing customers. we always need an overview of the status of each customer. these data, which we import from various third-party systems into planhat, can be viewed and acted upon by all employees of our company. Review collected by and hosted on G2.com."
