NAME,POSITION,Market size,No of emp,DATE,TITLE,LIKE,DISLIKE,BENEFITS
Andreas H.,Unknown,Small-Business,50 or fewer emp.,08-Mar-23,"""Planhat is a phenomenal tool for CSMs to organize their clients and to automate processes""","I love how easy it is to design reports that show the health of my clients. If one of my clients has an activity coming up, it is easy to log the activity and create a daily digest of what is due, what is coming up, and what I can put on the back burner. As you might expect of a company designed to be a tool for customer success, their customer support is awesome too! Review collected by and hosted on G2.com.","A bug has made it difficult for me to have the transparency I'd like with my management about my clients, resulting in the need to do a lot of manual work. Their dev team is working on a fix. The responsiveness of their support team and CSM gives me confidence that it will be a short-term issue! Review collected by and hosted on G2.com.",Planhat has reduced the need for our department to rely on multiple software and spreadsheets to manage our clients. This has freed up more time to focus on internal company improvements. Review collected by and hosted on G2.com.
Zehavit B.,Unknown,Small-Business,50 or fewer emp.,22-Feb-23,"""My every day, working with PlanHat""","All the available functions and its interface are friendly to the user. Has a wide variety of options for both CSM's and administrator users, reliable support and up-to-date with CS best practices.
","The SF integration took too much time than expected.
","All of the above, 
"
Jeremy S.,Customer Success Director EMEA,Mid-Market,51-1000 emp.,10-Jan-23,"""Planhat is a must for all Customer Success teams""","From a CSM's perspective Planhat enables them to have a single, easy-to-use application to effectively manage all of their customer interactions within: From health score, to next actions and automated plays. From a CX leadership perspective Planhat helps ensure consistency of CX delivery across the organisation coupled with necessary reporting. Review collected by and hosted on G2.com.","The user interface is super easy to use, however a small number of minor bugs with the display of icons exist. Review collected by and hosted on G2.com.","Aprimo needed a solution to both:
"
Jurgita P.,M,Mid-Market,51-1000 emp.,28-Nov-22,"""One tool to streamline information about customers""","We like the 360 degrees view the most. It allowed us to ditch all kinds of different spreadsheets and focus only on one source of truth, which makes us come up with faster solutions and decisions, as well as to keep everyone aligned on the next steps needed. If a client needs to be re-assigned to a new CSM, the information does not get lost, and from the Managers perspective this helps to save a tremendous amount of time
","There are still a few small bugs/glitches that we know are being addressed by their tech teams. 
","Planhat is providing transparent information about our clients, and allows everyone in the company to have the access to it, and contribute. Like this customer Success is not only the matter of Success team, but yes, the whole company Review collected by and hosted on G2.com."
Ryan O.,COO,Unknown,Unknown,11-Nov-22,"""Planhat has been a gamechanger for us!""",Unknown,Unknown,Unknown
Bethany B.,"Manager, Customer Experience & Success",Mid-Market,51-1000 emp.,09-Nov-22,"""Great service, easy to use platform""","My team feels supported by our CSM to be there whenever we want to enhance current business processes. He comes with best practices and is willing to build out reports, dashboards, or anything else that would make our day-to-day a bit easier. Review collected by and hosted on G2.com.","A test environment would allow us to build out playbooks or test health scores without affecting production data. You have to pay more in your contract to have a test area that doesn't work within budget; I believe that should be included. Reporting filters can be complex. Auto-saving would be an awesome enhancement (the way a google doc would); taking notes on a call and losing them when you accidentally close it out or hit the back button gets to be frustrating. Customer portal enhancements would be great as well, I do not feel confident directing my clients to log into their portal for practical use. Review collected by and hosted on G2.com.","Quickly view important metrics at a glance while on a call with a client (renewal date, monthly cost, goals, notes from previous call, etc.). Report on my team's book of business to ensure client distribution is done evenly. Confirm renewals within the tool that triggers to accounts team to process accordingly. Review collected by and hosted on G2.com."
Marija S.,Susiness System Analyst,Mid-Market,51-1000 emp.,08-Nov-22,"""Amazing tool that allows CS teams to stay on top of the game!""","One of the most user-friendly interfaces!
","I would say that Planhat is a young system with a lot of potential, and the fact that they are young means there is definitely room for improvement, and I am  very excited to see what its features will look like in the future Review collected by and hosted on G2.com.",It helps our overall customer journey from the beginning through reaching the success phase and it definitely helps reps be proactive with their Accounts. Review collected by and hosted on G2.com.
Alex R.,Chief Information Officer & Co-Founder,Small-Business,50 or fewer emp.,08-Nov-22,"""Very Easy to Setup, Very Easy To Use. Love it""","We have recently implemented PlanHat in to our organisation for use with Customer Success. The whole process of OnBoarding to getting started has been extremely easy - I've set up other systems like PlanHat previously and this was by far the most straightforward. The support and assistance we received from PlanHat, in particular Sam, via our weekly onboarding calls was excellent. If we ever had a question or problem - Sam or the support team were there to help out. Review collected by and hosted on G2.com.",So far I've not found anything that I personally dislike about PlanHat. The UI is really clean and straightforward. The setup was fantastic. If I were being incredibly picky - I'd say a native integration with Chargebee would be handy but we worked around this problem through changing our workflow into Hubspot and pulling in the data from there. Not a big issue at all. Review collected by and hosted on G2.com.,"EvaluAgent chose PlanHat to assist our Customer Success and Account Management teams with a single portal for managing customers during their contract with us - we can bring usage data, conversations from various platforms we use (email, zendesk, hubspot) all in to one place. We can also begin to standardise on processes through the use of Playbooks built-in to Planhat Review collected by and hosted on G2.com."
Mackenzie A.,Customer Success Operations Manager,Mid-Market,51-1000 emp.,03-Nov-22,"""Easy to use, great customer insights, world class support""","We use the calculated metrics to set up automations to help optimize processes between CS and Sales. It's easy to track all of our customer data and we use their integrations heavily. The UI is easy to use and fun to set up. The learning curve isn't that big, and many customization options exist. The support team is very responsive (within minutes) and are always happy to help and answer questions. Our CSM Peter, is incredible and gives world class service. They also host a lot of webinars and have articles on CS best practices which helps the community learn and grow from best practices. Review collected by and hosted on G2.com.",They don't have robust note capabilities and charge for add-ons for simple functions you would expect to include in a CRM platform. There are limitations with visualizing and exporting data which I hope to see more improvements on. Review collected by and hosted on G2.com.,Having one tool to consolidate all data. The integrations make it easy to pull in all data from Salesforce and Zendesk and then we as a CS team can use that data how we'd like without interrupting other teams' workflows. There are so many options to customize and arrange the data to make it work for any business Review collected by and hosted on G2.com.
John W.,Product Specialist,Mid-Market,51-1000 emp.,02-Nov-22,"""Planhat is the Best in Class CS Platform - We Love it!""","I find that Planhat is best at taking every single data point and making it readily available and valuable.  We can measure our impact, growth, performance and more with the available data points.  It excels in how is presents the data and makes it readily available with reporting and dashboards that are easy to use and understand. Review collected by and hosted on G2.com.","To my point above, a lot of data can sometimes be overwhelming.  But once I have spent time in the system and better understood its sourcing and configurations, I was far less overwhelmed.   Its more of an initial shock when you see how capable the tool is, but that in turn, ends up being a good thing.  Its been easy to learn as well. Review collected by and hosted on G2.com.","Planhat is solving our problem of having so many sources of truth for client data.  Our CRM is very much geared toward sales. Thus, the CS team is left navigating between several different tools to gather information.  Planhat has agregating all of our data and is allowing us to leverage automation in a way that we have not done before.  Its building effeciency and insights into our client accounts that we have desperately needed for many years. Review collected by and hosted on G2.com."
Macy H.,Client Success Specialist,Small-Business,50 or fewer emp.,01-Nov-22,"""My experience with Planhat has been incredible!""","The customization that we are able to have with Planhat is unmatched. We love the Customer Portal, the ability to create dashboards ourselves, and the opportunity for automation in our daily routines. What we like best is the personnel. Everyone we have come in contact with, from sales to our CSM, Peter Robatille, has been personable, helpful, and willing to get creative with us to achieve our goals. Review collected by and hosted on G2.com.",It would be great to be able to set a default filter on the Data page and to be able to send and manage calendar invites in Planhat. More functionality around a true engagement score and adoption score would add more value for us. Not being able to comprehensively track product feedback at the portfolio level in PH is a downside for my team. Review collected by and hosted on G2.com.,Planhat helps us solve client information falling through the cracks. It has significantly reduced our tech stack and given my team visibility and the ability to get a holistic view of our accounts on both a company and user level. This is something we did not have before implementing Planhat. Review collected by and hosted on G2.com.
Patrick S.,Content Writer,Small-Business,50 or fewer emp.,01-Nov-22,"""Relentless support from a highly professional team of experts""","I'm not an technically-minded person, nor is my background in customer support. That said, much of what I do on a day-to-day basis includes both skillsets. Despite that, I've been successful in my position thanks to the Planhat team, whose ongoing support, guidance, and user interface have given my team everything we've needed for success (and then some). We are by no means the easiest client and have asked for several customizations, all of which the Planhat team has accomodated. I have not had a single negative experience in my year-long relationship with this team and would suggest them to absolutely anyone in the market. Consumate professionals, endlessly knowledgeable, and able to easily translate technical ideas to non-technical audiences. Review collected by and hosted on G2.com.","This is one of those questions where I feel that I'm really scraping the bottom of the barrel for an answer. In my experience, shortcomings around the Planhat team and interface have been almost non-existent. As I noted before, they have been relentlessly accommodating. If I had to reach to a distant limb for some minor constructive criticism, perhaps I'd say a more robust training experience for users -- but they're already working on that. If you'd asked me several months ago, perhaps I'd say a more customizable visual playbook experience -- but they heard that, listened, and designed the playbooks to our needs. I expect that if you asked me a year from now, my response would assume the same structure: we identified an issue -- something that needed a little tweaking for the distinct needs of our team -- and they immediately partnered with us to create it. Review collected by and hosted on G2.com.","Planhat allows us to create and execute a seamless white-glove client experience where nothing falls through the cracks. The data we're able to collect and action is unlike anything our company has ever seen. With every interaction with the Planhat team, I learn more about the robustness of the platform's capabilities. I expect that will continue as I continue to learn more and as platform interations continue to improve upon an already exceptional product. Review collected by and hosted on G2.com."
Gina M.,Customer Success Manager,Small-Business,50 or fewer emp.,01-Nov-22,"""It is a robust system yet very easy to use and navigate""",I like that there is a ton of info on Planhat. I like having the data for my customers laid out in one screen. I also like the notes and playbook use. And the fact that I can jump on a call with my CSM is huge. That takes the stress of trying to figure things out away. Their integrations with our other platforms is super helpful as well so I can have everything in one place. Review collected by and hosted on G2.com.,"I can't think of anything because its worked really well for what I have needed. I don't need anything other than my customer data, playbooks, automated emails etc. Review collected by and hosted on G2.com.","Having visibility on where my clients are, and the date I connected with them last, is really key. I have in one data page my last touches and the date my clients are rolling off and potentially not renewing, which is perfect. This is helpful to get ahead of the churn and make sure I have done all I can to keep the account. Review collected by and hosted on G2.com."
Carrie Z.,Director of Customer Success,Small-Business,50 or fewer emp.,01-Nov-22,"""An absolute must-have for CS teams""","Planhat knows customer success! The platform is easy to use but full of extremely powerful information for customer success teams. Setting it up was simple and our CSM was helpful guiding us through each step of the process. As experts in CS, the team understood our needs and was friendly, supportive and attentive during onboarding. The platform has become a part of our daily lives, where we can track everything from meeting notes, customer reminders, renewals, and playbooks in a modern and beautiful site. I have no idea how I worked in CS for 10 years without Planhat. No matter the size of a team, this solution is amazing. Review collected by and hosted on G2.com.",Nothing! We haven't run into any issues with the platform or the service they provide. Review collected by and hosted on G2.com.,"Planhat has made our team more efficient - with built in playbooks, email templates and reminders we can keep track of tasks and simplify (and automate) routine actions. Review collected by and hosted on G2.com."
Ben S.,Head of Customer Success,Small-Business,50 or fewer emp.,27-Oct-22,"""Great company, great service, and an amazing product.""","Everything! From the very start, the team have been amazing, clearly understanding the ever-changing priorities, issues, and goals of our company and being very flexible to come up with solutions that work for us. Aside from the service provided the product is great, super customisable, integrates easily with our current tech stack, and provides a level of detail for reporting that we just didn't have before. On top of this, the customer portal, playbooks, and automation are revolutionary, something that I have used for years now, they help provide a better service to our clients whilst streamlining our process, and reducing the amount of time spent by our team onboarding clients. Review collected by and hosted on G2.com.",If it was a little bit cheaper then that would be ideal but the value it adds is worth it. Review collected by and hosted on G2.com.,"There are a lot of ""Problems"" Planhat is solving but the main thing is giving oversite and transparency to the CS team and the wider company, historically we have had very little insight into usage, client health and even team processes, Planhat has ensured that this is no longer the case with dashboards, playbooks, and email tracking. Review collected by and hosted on G2.com."
Timothy S.,Teamlead Customer Success,Mid-Market,51-1000 emp.,25-Oct-22,"""Growing CSM platform for optimising you CSM processes and keeping your customers successful.""",Planhat has a lot of flexibility to adapt to your processes and company structure. The CSM team is super dedicated to helping you reach your goals. Where a year in now and our view of our customers has improved significantly. We can be a lot more pro-active and see that our CSMs know what their clients are doing. The pricing that is not user based is also a plus. Review collected by and hosted on G2.com.,"The initial setup took a while. This was partly due to the time we could invest but also due to a complicated setup. You feel it's a growing system because of some useability features that are not yet optimal. Working with a hierarchical structure is possible, but the setup and platform view did take time to get used to. Our Hubspot integration works well now, but still some added flexibility would be nice. Also, smaller things like tasks from playbooks and google meetings that are basically part of that task can't be merged eg. Review collected by and hosted on G2.com.","Helps us onboard our customers in a more uniform and structured way. Onboarding is now more easily scaleable. We can pro-actively follow up with customers and act before it's too late. We have a better overview of the ""health"" of our customers. Review collected by and hosted on G2.com."
Bentley B.,Customer Success Manager,Small-Business,50 or fewer emp.,02-Nov-22,"""The Cheesecake Factory of CRMs. So many options it can be overwhelming, but worth it in the end!""",I really love how the platform can pull in tons of information. I love being able to score and organize all my accounts as well as being an account manager. Having a page I can go to to see an overview of simple tasks or playbooks is also a plus. Review collected by and hosted on G2.com.,"I wouldn't consider it a dislike, but it is a difficult learning curve. Our admin is allowed to chat in for support, but I cannot. Since there is so much to do, it often becomes overwhelming to setup up my own views on reports. Our CSM is solid, but I don't know what I don't know. Review collected by and hosted on G2.com.",Planhat is tracking and visualizing data in terms of usage and moving from one playbook to another. Beforehand we were just manually adjusting or keeping a record of all of this data. This is the company's first CRM. Review collected by and hosted on G2.com.
Christina O.,Customer Success Manager,Mid-Market,51-1000 emp.,19-Oct-22,"""Nice platform for customer success that helps with a lot of insights and management of customers""","Planhat is fairly intuitive when it comes to the main functions for managing customers. E.g. it is great to configure own health scores for quick overview of customers well-being. In addition, several measures are available to easily understand how customers are using our product and in turn define measures of our own. Planhat is also great for capturing all events/meetings/notes on a customer that should be available in case the actual customer success manager isn't. Lastly, the option to share a customer portal with customers and use it as a joint platform for communicating to-dos and next steps, is of great value. Review collected by and hosted on G2.com.","There are still a couple of functionalities that don't work well, e.g. synching recurring calendar meetings, or mail that are in other folders than ""Inbox"". In addition, there sometimes are some hickups with the calculations in the background as well as information getting overwritten by automations. However, for the latter, it is hard to pinpoint the problem to Planhat or our own scripts, so this shouldn't be held solely to Planhats responsibility. Review collected by and hosted on G2.com.","It's giving me a quick overview of the most important customer-associated metrics and is thereby saving me a lot of time in analysis. It also helps a lot with knowledge transfer and simply tracking to-dos, thereby improving the work as a team. Review collected by and hosted on G2.com."
Nico K.,CS Operations Lead,Mid-Market,51-1000 emp.,19-Oct-22,"""Planhat helps us bringing our CS organization to the next level!""","To give you a better understanding of how we use Planhat I divided my feedback as following:
","As every software, also Planhat has some minor bugs here and there. While most of our reports have been solved very fast we still experience a bug related to the CRM-integration that we raised several weeks ago and which prevents us from using Planhat to 100%.
",#NAME?
Tess B.,Customer Success Manager,Mid-Market,51-1000 emp.,26-Oct-22,"""I would recommend Planhat!""","The product helps manage the project pipeline, correlating tasks and follow-ups. The playbooks are versatile and address most of our needs. The articles and the support team are great if I am in a pinch; I can definitely get answers to my questions in a quick time frame. Review collected by and hosted on G2.com.","There is not much to contribute here. One specific option would maximize time and minimize a few redundancies. For example: Directly linking a calendar task to a playbook task rather than clicking both as done and remembering where to record time and details for metrics would reduce time in entry, potential errors and redundancy. Review collected by and hosted on G2.com.",I can easily check on the health of the projects and keep track of follow-ups and associated necessary tasks. The integrations and ability to see the activity of those involved with a few clicks allow me to pivot priorities and address potential issues sooner. Review collected by and hosted on G2.com.
Richard Z.,Customer Success Team Lead,Mid-Market,51-1000 emp.,18-Oct-22,"""An amazing tool for CSM team and management""","- playbooks are amazing ways to track performance and to keep track of your (your teams') activities and progress
","- customer-facing portal is a super important feature because it's the first thing that customer sees from you (when sharing onboarding instructions for example), but at the moment the level of customization is very limited. It's definitely not the prettiest-looking portal and the fact that you cannot fully customize it make it less practical
","Sharing customer portals, providing instructions for onboarding, different automation that runs if the customer has any issue within our app, escalating issue to management, and more. Review collected by and hosted on G2.com."
Jordan F.,Senior Customer Success Manager,Small-Business,50 or fewer emp.,14-Oct-22,"""Planhat allows me and my team to succeed""","Planhat is easily customizable to:
","The email system is pretty terrible in terms of formatting - lists, tables etc. Needs a bit more robustsness like outlook.
","Contact management is big in our organization. Being able to customize and easily see your customers and divide them for stakeholder engagement is huge for our team. We have never had an easy way to see our contacts beyond spreadsheets. We can also now learn from each other and use the data from each customer to understand who our true champions are, and flag customers that may churn. running playbooks are great too. Review collected by and hosted on G2.com."
Jennifer S.,"SVP, Basis Customer Experience",Mid-Market,51-1000 emp.,07-Oct-22,"""A game changer for our Customer Experience team.""","We recently launched with Planhat, after a lengthy vendor selection process.  Given the complexities of our internal systems and data needs, we had many technically heavy discussions with stakeholders from both companies to ensure we could get all necessary data into Planhat.  From the early stages with our Corp Dev team, Planhat was a favorite.  We had the pleasure of working with Chris (CCO) from day 1.  The integration took about six months.  Our tech leads, Niklas (CTO) and Nicci were just as supportive and informative.  Nicci has been instrumental in every aspect of our integration, launch, and beyond.   Although the integration took longer than expected (primarily because of all the various integration pieces we needed), we never lost sight of the goal, nor did we have to make concessions. We officially launched in July, and Planhat is now our official CS system of record.  
","We don't dislike anything.  There are some areas/actions that aren't as intuitive as others.  Planhat offers so much flexibility, requiring time to maximize all its capabilities. Review collected by and hosted on G2.com.",Helping us to level up our customer support efforts.  We have seen many improvements in our Onboarding and Customer Success practices from which we believe all involved will benefit significantly. Review collected by and hosted on G2.com.
